{"id":"IA-S4A.5","title":"Real Golden Path","phase":"STUDIO-4A.5","goal":"Execute one real Math AI Studio Golden Path with animated video and Edge TTS narration.","allowedPaths":[".serena/**","media/**","audio/**","server/services/edgeTtsEngine.ts","tests/studio-real-golden-path-phase4a5.test.ts","image-animation/automation/specs/IA-S4A.5.json"],"forbiddenPaths":["server/services/math*/**","server/geometry/**","server/adapters/**","local_bridge/**","manim_toolkit/**","image-animation/core/**","image-animation/renderers/**","src/**"],"requirements":["Use existing Studio API, math, Scene Graph, timeline, Manim, Edge TTS, bridge, FFmpeg, and Frame QA paths.","Never synthesize or substitute audio.","Preserve generated artifacts without staging them."],"requiredTests":["npm run lint","npm run build","npm run qa:regression","npm run ia:regression"],"maxRepairAttempts":3,"architectureChangeAllowed":false,"expectedBranch":"develop/studio-phase-4","protectedPaths":["server/geometry/**","server/adapters/**","local_bridge/**","manim_toolkit/**","image-animation/core/**","image-animation/renderers/**","src/**"],"architectureProtectedPaths":["server/geometry/**","server/adapters/**","local_bridge/**","manim_toolkit/**","image-animation/core/**","image-animation/renderers/**","src/**","image-animation/automation/gates/**","image-animation/automation/scripts/**"],"agentAllowedPaths":["server/services/edgeTtsEngine.ts","tests/studio-real-golden-path-phase4a5.test.ts"]}
