{"id":"IA-S4A.4","title":"Authoritative Frame QA","phase":"STUDIO-4A.4","goal":"Make the existing Frame QA authoritative and fail closed.","allowedPaths":[".serena/**","media/**","src/types/localRender.ts","server/services/visualFrameQAService.ts","server/services/repairOrchestrator.ts","tests/studio-frame-qa-phase4a4.test.ts","tests/studio-frame-qa-live-phase4a4.test.ts","image-animation/automation/specs/IA-S4A.4.json"],"forbiddenPaths":["server/services/math*/**","server/geometry/**","server/adapters/**","local_bridge/**","manim_toolkit/**","image-animation/core/**","image-animation/renderers/**"],"requirements":["Reuse the existing Frame QA service and fail closed.","PASS requires completed analysis and valid artifacts.","Preserve generated .serena and media content without staging them."],"requiredTests":["npm run lint","npm run build","npm run qa:regression","npm run ia:regression"],"maxRepairAttempts":3,"architectureChangeAllowed":false,"expectedBranch":"develop/studio-phase-4","protectedPaths":["server/geometry/**","server/adapters/**","local_bridge/**","manim_toolkit/**","image-animation/core/**","image-animation/renderers/**"],"architectureProtectedPaths":["server/geometry/**","server/adapters/**","local_bridge/**","manim_toolkit/**","image-animation/core/**","image-animation/renderers/**","image-animation/automation/gates/**","image-animation/automation/scripts/**"],"agentAllowedPaths":["src/types/localRender.ts","server/services/visualFrameQAService.ts","server/services/repairOrchestrator.ts","tests/studio-frame-qa-phase4a4.test.ts","tests/studio-frame-qa-live-phase4a4.test.ts"]}
