{"id":"IA-S4B.1","title":"Studio Full Video Orchestration","phase":"STUDIO-4B","goal":"Extend the existing Studio API and orchestrator to execute the verified real video pipeline end to end.","allowedPaths":[".serena/**","media/**","audio/**","server/studio/taskContracts.ts","server/studio/taskValidation.ts","server/studio/capabilityPlanner.ts","server/studio/studioOrchestrator.ts","server/services/edgeTtsEngine.ts","tests/studio-real-golden-path-phase4a5.test.ts","tests/studio-full-video-phase4b.test.ts","tests/studio-full-video-real-phase4b.test.ts","image-animation/automation/specs/IA-S4A.5.json","image-animation/automation/specs/IA-S4B.1.json"],"forbiddenPaths":["server/services/math*/**","server/geometry/**","server/adapters/**","local_bridge/**","manim_toolkit/**","image-animation/core/**","image-animation/renderers/**","src/**"],"requirements":["Extend only the existing Studio API and Studio Orchestrator.","Use existing math, Scene Graph, timeline, Manim, Edge TTS, renderer, bridge, FFmpeg, and Frame QA components.","Fail closed at every mandatory stage and emit execution trace entries as stages run.","Never expose arbitrary local artifact paths in the public result.","Never synthesize or substitute audio."],"requiredTests":["npm run lint","npm run build","npm run qa:regression","npm run ia:regression","node --import tsx tests/studio-full-video-phase4b.test.ts","node -r dotenv/config --import tsx tests/studio-full-video-real-phase4b.test.ts"],"maxRepairAttempts":3,"architectureChangeAllowed":false,"expectedBranch":"develop/studio-phase-4","protectedPaths":["server/geometry/**","server/adapters/**","local_bridge/**","manim_toolkit/**","image-animation/core/**","image-animation/renderers/**","src/**"],"architectureProtectedPaths":["server/geometry/**","server/adapters/**","local_bridge/**","manim_toolkit/**","image-animation/core/**","image-animation/renderers/**","src/**","image-animation/automation/gates/**","image-animation/automation/scripts/**"],"agentAllowedPaths":["server/studio/taskContracts.ts","server/studio/taskValidation.ts","server/studio/capabilityPlanner.ts","server/studio/studioOrchestrator.ts","server/services/edgeTtsEngine.ts","tests/studio-real-golden-path-phase4a5.test.ts","tests/studio-full-video-phase4b.test.ts","tests/studio-full-video-real-phase4b.test.ts"]}
